SKU#,Description,Local Description,Unit,Qty From,QtyTo,Quote Price,Foc,Discount Percent,Discount Amount,TaxType,TaxRate,Vendor SKU#,Comment
'31000021,BATTERY(AA)-ALKALINE1.5V Panasonic,ถ่านแบตเตอร์รี่(AA)-อัลคาไลน์ ยี่ห้อพานาโซนิค,PCS,,,25,,,,A,7,,
'31000023,DRY BATTERY - AAA - ALKALINE Panasonic,ถ่านแบตเตอร์รี่ AAA อัลคาไลน์ ยี่ห้อพานาโซนิค,PCS,,,25,,,,A,7,,
'31000028,BATTERY Size D  Panasonic/Green,ถ่านไฟฉายก้อนใหญ่ไซด์ D ยี่ห้อพานาโซนิค(สีเขียว),PCS,,,25,,,,A,7,,
'40010015,BLACK SILICONE L 6301 ( SONY ),ซิลิโคนดำรุ่น L6301 ยี่ห้อ SONY,PCS,,,215,,,,A,7,,
'40010016,CLEAR SILICONE SONIE 330 ML.,ซิลิโคนใส ยี่ห้อโซนี่ 330 ML.,PCS,,,215,,,,A,7,,
'40010165,พุ๊กตัวหนอน #  7,พุ๊กตัวหนอน #  7,BOX,,,,,,,A,7,,
'41010007,THERMOROOM AIR TTLT-TTL004 ODIGITAL /A80063-171,THERMOROOM AIR TTLT-TTL004 ODIGITAL /A80063-171,SET,,,,,,,A,7,,
'41010044,สเปร์ยโฟมสำหรับล้างแอร์ ยี่ห้อนอร์ก้า 500 มล.,สเปร์ยโฟมสำหรับล้างแอร์ ยี่ห้อนอร์ก้า 500 มล.,Can,,,,,,,A,7,,
'41050020,"BALL VALVE(MINI) SANWA 3WAY 1/2""","มินิบอลวาวล์ 1/2"" ยี่ห้อซันวา 3 ทาง(ผผผ) ",PCS,,,,,,,A,7,,
'40010001,ELECTRIC TAPE(BLACK COLOUR)-3M,เทปพันสายไฟสีดำ ยี่ห้อ 3 เอ็ม,ROLL,,,,,,,A,7,,
'40010002,GLUE HOT BROVO 20G.,กาวร้อนตราโบโว 20G.,PCS,,,,,,,A,7,,
'40010009,"CABLE TINE 6"" (1*100)/BAG",เคเบิ้ลไทน์ 6 นิ้ว (1*100)/ถุง,BAG,,,25,,,,A,7,,
'40010010,TILE GRONT CROCODILE(PEARL WHITE) 1 KG/BAG,กาวยาแนวป้องกันเชื้อราตราจะเข้(ขาวมุก) 1กก./ถุง,BAG,,,,,,,A,7,,
'40010015,BLACK SILICONE L 6301 ( SONY ),ซิลิโคนดำรุ่น L6301 ยี่ห้อ SONY,PCS,,,215,,,,A,7,,
'40010016,CLEAR SILICONE SONIE 330 ML.,ซิลิโคนใส ยี่ห้อโซนี่ 330 ML.,PCS,,,,,,,A,7,,
'40010024,ยางกันแมลง 1 เมตรรุ่น king#11-01สีน้ำตาล,ยางกันแมลง 1 เมตรรุ่น king#11-01สีน้ำตาล,PCS,,,,,,,A,7,,
'40010061,"CUTTING FIBER 14"" # MAKITA",ใบไฟเบอร์ 14 นิ้ว ยี่ห้อมากีต้า,PCS,,,,,,,A,7,,
'40010069,DRILL HEAD SIZE 8 MM (1*2),ดอกสว่านเจาะเหล็ก 8 มม.(1*2),PCS,,,,,,,A,7,,
'40010079,LAVATORY COVER PIXO TE-04,ฝาปิดชักโครก PIXO TE-04,PCS,,,,,,,A,7,,
'40010101,"STAINLESS DRILL 5/32"" ",ดอกสว่านสแตนเลสเจาะเหล็ก 5/32 นิ้ว,PCS,,,,,,,A,7,,
'40010112,TOILET SPRAY AMS.M/A-4900-ST(NON STOPVALVE),สายฉีดชำระ ยี่ห้อ AMS.รุ่น A-4900-ST,PCS,,,,,,,A,7,,
'40010118,WHITE SILICON SONIE 330 ML.,ซิลิโคนขาว ยี่ห้อโซนี่ 330 มล.,PCS,,,,,,,A,7,,
'40010150,ชุดฝักบัวสายอ่อน3Fพร้อมสายและขอแขวน F46306-CHADY-HS,ชุดฝักบัวสายอ่อน3Fพร้อมสายและขอแขวน F46306-CHADY-HS,SET,,,,,,,A,7,,
'40010151,ชุดหัวฝักบัวสายอ่อน 1F ยี่ห้อAMS.M/F46103-CHADYHS,ชุดหัวฝักบัวสายอ่อน 1F ยี่ห้อAMS.M/F46103-CHADYHS,SET,,,,,,,A,7,,
'40010153,ซีลประตูกระจกสีใส 8-10มม.HAFELE(489.41.076),ซีลประตูกระจกสีใส 8-10มม.HAFELE(489.41.076),SET,,,,,,,A,7,,
'40010162,ฝักบัวก้านแข็งยี่ห้อ KARAT M/KS-05-113-50,ฝักบัวก้านแข็งยี่ห้อ KARAT M/KS-05-113-50,SET,,,,,,,A,7,,
'40010182,สะดืออ่างอาบน้ำป๊อบอัฟ รุ่น A-1841,สะดืออ่างอาบน้ำป๊อบอัฟ รุ่น A-1841,PCS,,,,,,,A,7,,
'40010227,"สายน้ำดีเข้าถังพัก PC-110333 ขนาด 1/2""X 3/4""","สายน้ำดีเข้าถังพัก PC-110333 ขนาด 1/2""X 3/4""",Pcs,,,,,,,A,7,,
'41010007,THERMOROOM AIR TTLT-TTL004 ODIGITAL /A80063-171,THERMOROOM AIR TTLT-TTL004 ODIGITAL /A80063-171,SET,,,,,,,A,7,,
'41010044,สเปร์ยโฟมสำหรับล้างแอร์ ยี่ห้อนอร์ก้า 500 มล.,สเปร์ยโฟมสำหรับล้างแอร์ ยี่ห้อนอร์ก้า 500 มล.,Can,,,,,,,A,7,,
'41040100,ชุดเต้ารับคู่มีกราวน์มีม่านนิรภัย(สีขาว)+USB 3.1A/5V 2ช่อง รุ่น CP55U-W ยี่ห้อนาโน,ชุดเต้ารับคู่มีกราวน์มีม่านนิรภัย(สีขาว)+USB 3.1A/5V 2ช่อง รุ่น CP55U-W ยี่ห้อนาโน,Set,,,,,,,A,7,,
'41040107,หางปลาเสียบแอร์ตัวเมีย(สีน้ำเงิน) V2.5-7A 100ตัว/แพ็ค,หางปลาเสียบแอร์ตัวเมีย(สีน้ำเงิน) V2.5-7A 100ตัว/แพ็ค,Pack,,,170,,,,A,7,,
'41040111,พัดลมระบายอากาศฝังฝ้า รุ่น VD10Z4T3 ยี่ห้อ MITSUBISHI ,พัดลมระบายอากาศฝังฝ้า รุ่น VD10Z4T3 ยี่ห้อ MITSUBISHI ,Pcs,,,,,,,A,7,,
'41040112,ตะแกรงพัดลมสีดำ 16 นิ้ว(หน้า/หลัง)/ชุด ยี่ห้อฮาตาริ,ตะแกรงพัดลมสีดำ 16 นิ้ว(หน้า/หลัง)/ชุด ยี่ห้อฮาตาริ,Set,,,,,,,A,7,,
'41040113,ตะแกรงพัดลมสีดำ 16 นิ้ว(หน้า/หลัง)/ชุด ยี่ห้อชาร์ป,ตะแกรงพัดลมสีดำ 16 นิ้ว(หน้า/หลัง)/ชุด ยี่ห้อชาร์ป,Set,,,,,,,A,7,,
'41050020,"BALL VALVE(MINI) SANWA 3WAY 1/2""","มินิบอลวาวล์ 1/2"" ยี่ห้อซันวา 3 ทาง(ผผผ) ",PCS,,,,,,,A,7,,
'41090035,TOA GLIPTON # G682 ( GRAY ) SIZE 3.785 L.,สี TOA GLIPTON # G682 ( GRAY ) SIZE 3.785 ลิตร,GAL,,,,,,,A,7,,
'41090046,ROADLINE PAINT BLACK #0719/3L.TOA ,สีทาถนนสีดำสะท้อนแสง#0719/3 ลิตร ยี่ห้อทีโอเอ,GAL,,,,,,,A,7,,
'41090061,ROADLINE PAINT RED #715/3L.TOA,สีทาถนนสีแดงสะท้อนแสง#715/3 ลิตร ยี่ห้อทีโอเอ,Gal,,,,,,,A,7,,
'41090069,ROADLINE PAINT WHITE #717/3L.TOA,สีทาถนนสีขาวสะท้อนแสง#717/3 ลิตร ยี่ห้อทีโอเอ,Gal,,,,,,,A,7,,
'41090070,สีน้ำอะคริลิคสีขาวด้าน#8300 SNOWFLAKE รุ่น 4SEASON ยี่ห้อ TOA 9L.,สีน้ำอะคริลิคสีขาวด้าน#8300 SNOWFLAKE รุ่น 4SEASON ยี่ห้อ TOA 9L.,Tank,,,,,,,A,7,,
'41130003,เคเบิ้ลไทน์ 10 นิ้ว(1*100)/ถุง,เคเบิ้ลไทน์ 10 นิ้ว(1*100)/ถุง,BAG,,,50,,,,A,7,,
'41130004,เคเบิ้ลไทน์ 4 นิ้ว(1*100)/ถุง,เคเบิ้ลไทน์ 4 นิ้ว(1*100)/ถุง,BAG,,,10,,,,A,7,,
'43030008,หลอดไฟT5 PE LED 14W 3000K,หลอดไฟ T5 PE LED 14W3000K,PCS,,,,,,,A,7,,
'43030011,PAR38 LED 15W -E27 วอร์มไวท์ นูไล,หลอด PAR38 LED 15W/WW-E27,PCS,,,,,,,A,7,,
'43030026,LED 3W3000KE27-WW,หลอดไฟแอลอีดี 3W3000KE27-แสงวอร์มไวท์,PCS,,,,,,,A,7,,
'43030032,LED PAR38 13-15W DIMMABLE,หลอดแอลอีดี PAR38 13-15W(หรี่แสงได้),PCS,,,,,,,A,7,,
'43030044,ไฟฉายแบบมีที่คาดหัว LED,ไฟฉายแบบมีที่คาดหัว LED,SET,,,,,,,A,7,,
'43030062,LED BEC MR16 5W 220V3000K/WW,LED BEC MR16 5W 220V3000K/WW,Pcs,,,,,,,A,7,,
'43030068,SPORLIGHT LED IP66 1000W2500LM/220VAC-(DAYLIGHT),สปอตไลท์ IP66 1000W2500LM/220VAC-(แสงสีขาว),Pcs,,,,,,,A,7,,
