SKU#,Description,Local Description,Unit,Qty From,QtyTo,Quote Price,Foc,Discount Percent,Discount Amount,TaxType,TaxRate,Vendor SKU#,Comment
'31000035,DRINKING STRAW COLORFUL 8MM.( 1*250 PCS ),หลอดดูดข้องอ คละสี 8มม. ( 1*250 ชิ้น ),PACK,,,,,,,A,7,,
'31000036,หลอดดูดข้องอจัมโบ้ 8 มม. สีส้ม(1*200),หลอดดูดข้องอจัมโบ้ 8 มม. สีส้ม(1*200),PACK,,,,,,,A,7,,
'31000037,DRINKING STRAW WHTIE 6 MM.( 1 * 250 PCS ),หลอดดูดข้องอสีขาว 6 มม. ( 1 * 250 อัน ),PACK,,,,,,,A,7,,
'31000038,หลอดดูดข้องอสีน้ำตาล 6มม.(ห่อฟิล์ม)1*100/แพ็ค,หลอดดูดข้องอสีน้ำตาล 6มม.(ห่อฟิล์ม)1*100/แพ็ค,PACK,,,,,,,A,7,,
'31000074,DRINKING STRAW WHITE  6mm.1*100/bag,หลอดดูดข้องอสีขาว 6มม.(ซองกระดาษ)1*100/ห่อ,BAG,,,20.61,,,,A,7,,
'31000144,หลอดดูดข้องอจัมโบ้ 8 มม.(คละสี) 1*250/แพ็ค,หลอดดูดข้องอจัมโบ้ 8 มม.(คละสี) 1*250/แพ็ค,PACK,,,,,,,A,7,,
'31000145,หลอดดูดข้องอน้ำตาล 6 มม.(ไม่ห่อฟิล์ม) 1*250/ห่อ,หลอดดูดข้องอน้ำตาล 6 มม.(ไม่ห่อฟิล์ม) 1*250/ห่อ,PACK,,,19.63,,,,A,7,,
'32000035,RUBBER BIG,ยางวงใหญ่,PACK,,,67.76,,,,A,7,,
'34030002,METCH  GUN,ปืนยิงแก๊ส,PCS,,,32.4,,,,A,7,,
'34030008,"COLD PLASTIC BAG 6"" X 9 ""","ถุงพลาสติกเย็น 6"" X 9""",KG,,,98.13,,,,A,7,,
'34030009,"COLD PLASTIC BAG 8"" X 14""","ถุงพลาสติกเย็น 8"" X 14""",KG,,,98.13,,,,A,7,,
'34030010,"BAMBOO STICK 6""(1*200)","ไม้เสียบ BBQ. 6""(1*200)",PACK,,,24.85,,,,A,7,,
'34030016,"COLD PLASTIC BAG 5"" X 8""","ถุงพลาสติกเย็น 5"" X 8""",KG,,,98.13,,,,A,7,,
'34030017,ถุงหูหิ้วใส 8*16 นิ้ว,ถุงหูหิ้วใส 8*16 นิ้ว,KG,,,127.58,,,,A,7,,
'34030041,"COLD PLASTIC BAG 12""x18""","ถุงพลาสติกเย็น 12""x18""(แบบบาง)",KG,,,98.13,,,,A,7,,
'34030042,"COLD PLASTIC BAG 20*30 ""(1*100)/(193139)","ถุงพลาสติกเย็น 20*30""(1*100)/(193139)",KG,,,98.13,,,,A,7,,
'34030043,"COLD PLASTIC BAG 6X 12""","ถุงพลาสติกเย็น 6X 12""",KG,,,98.13,,,,A,7,,
'34030052,"HAND BAG PLASTIC 12*20""","ถุงพลาสติกมีหูหิ้ว 12*20""",KG,,,127.58,,,,A,7,,
'34030053,"HAND BAG PLASTIC 15*30""","ถุงพลาสติกมีหูหิ้ว 15*30""",KG,,,127.58,,,,A,7,,
'34030058,"HOT PLASTIC BAG 5*8""","ถุงพลาสติกร้อน 5*8""",KG,,,98.13,,,,A,7,,
'34030059,"HOT PLASTIC BAG  6*9""","ถุงพลาสติกร้อน 6*9""",KG,,,98.13,,,,A,7,,
'34030060,"HOT PLASTIC PP 5*26""","ถุงพลาสติกร้อน PP 5*26""",KG,,,98.13,,,,A,7,,
'34030076,"PLASTIC CARRY BAG 12*20"" ","ถุงพลาสติกมีหูหิ้วใส 12*20""",KG,,,127.58,,,,A,7,,
'34030077,"PLASTIC CARRY BAG SIZE 9*18""(831387)","ถุงพลาสติกหูหิ้ว 9*18""(831387)",KG,,,127.58,,,,A,7,,
'34030083,SANDWICH BOX 7*11*15 (1*100)/PACK,กล่องแซนวิชเล็ก 7*11*15 ซม.(1*100)/แพ็ค,PACK,,,147.2,,,,A,7,,
'34030182,ไม้เสียบหมูสะเต๊ะ 5 นิ้ว 2.5 มม.,ไม้เสียบหมูสะเต๊ะ 5 นิ้ว 2.5 มม.,BAG,,,23.54,,,,A,7,,
34030082,RUBBER SMALL SIZE 0.5 KG. ( 8859239100010),ยางวงเล็ก 0.5 กก.(8859239100010),PACK,,,67.76,,,,A,7,,
'31000119,TOOTH PICK 1*500/Pack 133519,ไม้จิ้มฟัน(ห่อกระดาษ) 1*500/แพ็ค,PACK,,,57.94,,,,A,7,,
'32000014,RUBBER GLOVE ORANGE SIZE M(PAIR),ถุงมือยางสีส้ม(หนา)ไซด์เอ็ม(คู่),PAIR,,,,,,,A,7,,
'32000015,RUBBER GLOVE WHITE POWDERD SIZE M(100P/BOX),ถุงมือยางอนามัยสีขาวแบบมีแป้งไซด์M (100ชิ้น/กล่อง),BOX,,,142.29,,,,A,7,,
'32000016,SAFE FIRE ALCOHOL JEL 15 KG.,แอลกอฮอล์เจลอุ่นอาหาร 15 กก.,TANK,,,1521.03,,,,A,7,,
'32000017,"SCOTH BRITE GREEN#96 3M 6*9""(1*10)/PACK","สก็อตไบร์สีเขียว 6*9""(1*10)/แพ็ค",PACK,,,192.29,,,,A,7,,
32000124,SCOTH BRITE STEEl 3M 10G.(1*12)/PACK,ฝอยสเตนเลส 14ก.ยี่ห้อสก๊อตช์-ไบรต์(1*6)/แพ็ค(127664),PACK,,,67.76,,,,A,7,,
'32000019,SOFT BROOM (ด้ามมัดลวด),ไม้กวาดดอกอ้อ(ด้ามมัดลวด),PCS,,,,,,,A,7,,
'32000020,SOFT BROOM(BAMBOO HANDLE),ไม้กวาดดอกอ้อด้ามไม้ไผ่,PCS,,,,,,,A,7,,
'32000023,SUN LIGHT 20 L.( 8851932042116 ),น้ำยาล้างจาน ซันไลต์ 20 ลิตร,GAL,,,873.36,,,,A,7,,
'32000024,SUN LIGHT-REFILL 3600 ML.,น้ำยาล้างจาน(แบบเติม)ซันไลต์ 3600 มล.,GAL,,,167.06,,,,A,7,,
'32000036,"SCOTH BRITE 3M WHITENo.9030 SIZE 4 x 5""(1*10)",สก็อตไบร์สีขาวยี่ห้อ 3M ขนาด 4 x 5 (1 x 10),PACK,,,,,,,A,7,,
'32000039,ATTACK 1600G(106057),ผงซักฟอก ยี่ห้อแอทแทค 1600ก.(106057),BAG,,,,,,,A,7,,
'32000040,DETERGENT 25KG.SAVEPACK(100570),ผงซักฟอก 25 กก.ตราเซพแพ็ค(100570),TANK,,,578.04,,,,A,7,,
'32000041,HYTER BLUE COLOUR  2500 ML.(119756),ไฮเตอร์สีฟ้าขนาด 2500 มล.(119756),BTL,,,69.63,,,,A,7,,
'32000042,น้ำยาล้างห้องน้ำ เป็ดโปรสีม่วง 3500ML (763581),น้ำยาล้างห้องน้ำ เป็ดโปรสีม่วง 3500ML (763581),GAL,,,165.89,,,,A,7,,
'32000043,CLEANER MAGICLEAN FLOOR 1800ML.(134087),น้ำยาถูพื้น(กลิ่นลาเวนเดอร์) ยี่ห้อมาจิคลีน 1800มล.,BTL,,,97.2,,,,A,7,,
'32000049,SOFTENER FINELINE 20L.(8851989030937),น้ำยาปรับผ้านุ่ม ไฟน์ไลน์ชมพูเข้ม 20ล.(8851989030937),GAL,,,412.15,,,,A,7,,
'32000050,SOFTENER COMFORT 20L.( 8851932090742 ),น้ำยาปรับผ้านุ่ม คอมฟอร์ทสีฟ้า 20ล.,GAL,,,578.04,,,,A,7,,
'32000055,"ALUMINUM FOIL 18 ""1*37.5D/(857645)",อลูมิเนียมฟอย์ด ยี่ห้อไดมอนด์ 18 นิ้ว1*37.5D/(857645),ROLL,,,137.38,,,,A,7,,
'32000056,BAYGON # LAVENDER SIZE 600 ML. ( 1*3) CAN )178465,สเปรย์กำจัดยุง มด แมลงสาบกลิ่นลาเวนเดอร์ไบกอน 600 มล.,CAN,,,104.98,,,,A,7,,
'32000064,DETTOL HYGIENIC 750 ML.(177620),น้ำยาฆ่าเชื้อ เดทตอลไฮยีน 750 มล.(177620),BTL,,,414.95,,,,A,7,,
'32000110,ฟองน้ำพร้อมใยขัด 3M (1x12)/(106570),ฟองน้ำพร้อมใยขัด 3M (1x12)/(106570),PACK,,,153.04,,,,A,7,,
'32000111,สเปรย์ไล่จิ้งจก ยี่ห้อกรีนเฮ้าส์ขนาด 300 มล.(905721),สเปรย์ไล่จิ้งจก ยี่ห้อกรีนเฮ้าส์ขนาด 300 มล.(905721),CAN,,,82.48,,,,A,7,,
'32000112,สเปรย์ไล่หนู ยี่ห้อกรีนเฮ้าส์ขนาด 300 มล.(905722),สเปรย์ไล่หนู ยี่ห้อกรีนเฮ้าส์ขนาด 300 มล.(905722),CAN,,,,,,,A,7,,
'34030004,ถุงกระดาษพับข้างน้ำตาล#1 4*6 นิ้ว(1*100)/แพ็ค,ถุงกระดาษพับข้างน้ำตาล#1 4*6 นิ้ว(1*100)/แพ็ค,PACK,,,165.89,,,,A,7,,
'34030086,SPONGE WITH NET ( 1 X 12 PCS ) 3.5*6 นิ้ว 100612,ฟองน้ำตาข่าย ( 1 X 12 ชิ้น )ใช้ล้างแก้ว 3.5*6 นิ้ว,PACK,,,142.29,,,,A,7,,
'34030092,WOOD CHOP STICK (1*70PAIR)/PACK,ตะเกียบไม้ห่อฟิล์ม (1 x70คู่ )/แพ็ค,PACK,,,28.5,,,,A,7,,
'34030093,WOOD CHOP STICK (1*80PAIR)/PACK,ตะเกียบไม้ห่อฟิล์ม (1*80คู่)/แพ็ค,PACK,,,28.5,,,,A,7,,
'34030094,WOOD CHOP STICK 22 cm.( 1*70PAIR)/PACK,ตะเกียบไม้ 22 ซม.ห่อพลาสติก (1*70คู่)/แพ็ค,PACK,,,28.5,,,,A,7,,
'34030095,แก้วใสพีพีขนาด 16 ออนซ์ทรงแคปซูล(1x 50)/870262,แก้วใสพีพีขนาด 16 OZ.ทรงแคปซูล(1x 50)/870262,PACK,,,69.63,,,,A,7,,
'34030197,ถุงกระดาษหูเกลียวคราฟท์ 19*13*21cm.(1*25)/แพ็ค,ถุงกระดาษหูเกลียวคราฟท์ 19*13*21cm.(1*25)/แพ็ค,Pack,,,191.36,,,,A,7,,
'34030198,ถุงกระดาษหูเกลียวคราฟท์ 32*11*24cm.(1*25)/แพ็ค,ถุงกระดาษหูเกลียวคราฟท์ 32*11*24cm.(1*25)/แพ็ค,Pack,,,166.82,,,,A,7,,
'34030202,BOX FOOD 1000 ML.(1*25)/PACK,กล่องใส่อาหาร 1 ช่อง 1000 มล.(1*25)/แพ็ค,Pack,,,312.14,,,,A,7,,
'34030012,ถุงกระดาษหูเกลียวคราฟท์  23*15*23 cm.(1*25)/197638,ถุงกระดาษหูเกลียวคราฟท์  23*15*23 cm.(1*25)/197638,PACK,,,234.58,,,,A,7,,
