SKU#,Description,Local Description,Unit,Qty From,QtyTo,Quote Price,Foc,Discount Percent,Discount Amount,TaxType,TaxRate,Vendor SKU#,Comment
'10010021,กระดูกเล้งหมู สับ,กระดูกเล้งหมู(สับ),KG,0,,70,,,,N,0,,
'10020023,CHICKEN WHOLE,ไก่ตัว,KG,0,,78,,,,N,0,,
'10020008,CHICKEN MEAT GROUND,ไก่บด,KG,0,,79,,,,N,0,,
'10020001,CHICKEN  CUTED,ไก่สับชิ้น(แกง),KG,0,,72,,,,N,0,,
'10020022,CHICKEN CUTED,ไก่สับชิ้น(ทอด),KG,0,,72,,,,N,0,,
'10010022,ขั้วตับหมู,ขั้วตับหมู,KG,0,,145,,,,N,0,,
'10010023,ขาหมู (ขาหน้า),ขาหมู (ขาหน้า),KG,0,,85,,,,N,0,,
'10010018,PORK LEG,ขาหมู (ขาหลัง),KG,0,,90,,,,N,0,,
'10010009,PORK NECK,คอหมู,KG,0,,325,,,,N,0,,
'10020013,MIXED OFFAL CHICKEN,เครื่องในไก่,KG,0,,56,,,,N,0,,
'10020003,CHICKEN BONE ( RIBS ),ซี่โครงไก่,KG,0,,30,,,,N,0,,
'10010012,ซี่โครงหมูแผ่น 5 นิ้ว,ซี่โครงหมูแผ่น 5 นิ้ว,KG,0,,170,,,,N,0,,
'10010013,PORK RIB FROZEN SIZE 600-700G. (6-7KG./BOX),ซี่โครงหมูแผ่นขนาด 5 นิ้ว 600-700 (6-7กก./กล่อง),KG,0,,170,,,,N,0,,
'10010002,PORK BONE ( SPRIA ) SLICED,ซี่โครงหมูสับ,KG,0,,155,,,,N,0,,
'10010017,PORK CARILANG SLICED,ซี่โครงหมูอ่อนสับ,KG,0,,159,,,,N,0,,
'10010006,PORK LIVER,ตับหมู,KG,0,,70,,,,N,0,,
'10020007,CHICKEN LRG,ตีนไก่(ตีนไก่ตัดเล็บ),KG,0,,98,,,,N,0,,
'10020017,CHICKEN DRUM STICK WITH SIDE,น่องไก่ติดสะโพก,KG,0,,76,,,,N,0,,
'10020005,CHICKEN DRUM STICKS 2KG.,น่องไก่ล้วน 2 กก.,KG,0,,82,,,,N,0,,
'11000003,CAT FISH FRESH SLICED,ปลาดุกหั่นเนื้อล้วน,KG,0,,90,,,,N,0,,
'10020012,CHICKEN WINGS,ปีกไก่เต็ม,KG,0,,102,,,,N,0,,
'10020018,CHICKEN WINGS UP (Halan) 2KG.(893188),ปีกไก่บนฮาลาล 2 กก.(893188),KG,0,,82,,,,N,0,,
'10010004,PORK FAT,มันหมูแข็ง,KG,0,,65,,,,N,0,,
'10050030,CHICKEN 'S TENDON BALLS,ลูกชิ้นเอ็นไก่,KG,0,,75,,,,N,0,,
'10020010,CHICKEN TOP ROUND  WITH SKIN 2 KG.,สะโพกไก่ติดหนังเลาะกระดูก 2 กก.,KG,0,,84,,,,N,0,,
'10020011,CHICKEN TOP ROUND WITH SKIN SLICE (2KG.),สะโพกไก่ติดหนังสไลด์(2กก.),KG,0,,120,,,,N,0,,
'10020009,CHICKEN TOP ROUND  WITH OUT BONE&SKIN,สะโพกไก่ลอกหนังเลาะกระดูก,KG,0,,110,,,,N,0,,
'10010011,PORK TOP ROUND,สะโพกหมู,KG,0,,122,,,,N,0,,
'10010027,สันคอหมู,สันคอหมู,Kg,0,,178,,,,N,0,,
'10020006,CHICKEN FILLET,สันในไก่,KG,0,,79,,,,N,0,,
'10010010,PORK TENDERLOIN,สันในหมู,KG,0,,132,,,,N,0,,
'10050033,"CHICKEN SAUSAGE 3.5"" BATAGRO",ไส้กรอกไก่ 3.5นิ้ว(เบทาโกร),KG,0,,115.89,,,,A,7,,
'10050031,CHICKEN SAUSAGE,ไส้กรอกไก่รมควัน(หนังกรอบ) 1000ก.,KG,0,,115.89,,,,A,7,,
'10050047,PORK VIENNA SAUSAGE,ไส้กรอกเวียนนา,KG,0,,115.89,,,,A,7,,
'10010020,ไส้อ่อนหมู,ไส้อ่อนหมู,KG,0,,185,,,,N,0,,
'10010005,PORK HIP SLICED,หมูเนื้อแดงหั่น,KG,0,,129,,,,N,0,,
'10010008,PORK MINCED A,หมูบดเกรด A,KG,0,,140,,,,N,0,,
'10010007,PORK MEAT GROUND B,หมูบดเกรด B ปนมัน 20%,KG,0,,130,,,,N,0,,
'10010019,PORK LOIN,หมูสันนอก,KG,0,,132,,,,N,0,,
'10010014,PORK CHOP,หมูสันนอกติดกระดูก,KG,0,,350,,,,N,0,,
'10010003,PORK CHOP S-PURE,หมูสันนอกติดกระดูก(ทั้งเส้น),KG,0,,350,,,,N,0,,
'10010001,PORK BELLY,หมูสามชั้น,KG,0,,188,,,,N,0,,
'10010016,PORK BELLY SLICED,หมูสามชั้น(หั่น),KG,0,,199,,,,N,0,,
'10010024,หมูสามชั้นแผ่นมันบางๆ,หมูสามชั้นแผ่นมันบางๆ,KG,0,,188,,,,N,0,,
'10010025,หมูสามชั่นหั่นเต๋า,หมูสามชั่นหั่นเต๋า,KG,0,,199,,,,N,0,,
'10010026,หมูสามชั้นหั่นเส้นยาว,หมูสามชั้นหั่นเส้นยาว,KG,0,,199,,,,N,0,,
'10050022,HAM(PORK),หมูแฮม,KG,0,,225,,,,N,0,,
'10020016,CHICKEN BREAST WITH SKIN 2KG.,อกไก่ติดหนัง 2 กก.,KG,0,,68,,,,N,0,,
'10020020,CHICKEN BREAST WITH SKIN SLICE,อกไก่ติดหนังสไลด์,KG,0,,105,,,,N,0,,
'10020004,CHICKEN BREAST PACK 2KG.,อกไก่ลอกหนัง 2 กก.,KG,0,,80,,,,N,0,,
'10030001,SKINED DUCK MEAT BB1 1KG.,อกเป็ดเนื้อติดหนัง(BB1) 1 กก.,KG,0,,280,,,,N,0,,
'10030002,SMOKED DUCK BREAST 1 กก.,อกเป็ดรมควัน 1 กก.,KG,0,,430,,,,N,0,,
