SKU#,Description,Local Description,Unit,Qty From,QtyTo,Quote Price,Foc,Discount Percent,Discount Amount,TaxType,TaxRate,Vendor SKU#,Comment
'FD120177,APPLE GREEN,แอปเปิ้ลเขียว(6 ลูก/กก.),PCS,,,,,,,N,0,,
'FD120178,APPLE RED,แอปเปิ้ลแดง(6 ลูก/กก.),PCS,,,,,,,N,0,,
'FD120180,BANANA EGGS,กล้วยไข่,BUNCH,,,,,,,N,0,,
'FD120183,BANANA SWEET,กล้วยน้ำว้า,BUNCH,,,,,,,N,0,,
'FD120190,BLUEBERRY FRESH 125G.(103133),บลูเบอรี่สด 125ก.(103133),PACK,,,,,,,N,0,,
'FD120201,CHINESE ORANGE,ส้มจีน,KG,,,,,,,N,0,,
'FD120204,COCONUT MILK FRESH,น้ำกะทิสด,KG,,,,,,,N,0,,
'FD120209,DRAGON FRUIT,แก้วมังกรขาว,KG,,,,,,,N,0,,
'FD120217,GRAPE RED IMPORT 1KG.(112406),องุ่นแดงนอก 1 กก.(112406),KG,,,,,,,N,0,,
'FD120218,GRAPES GREEN (320775),องุ่นเขียว(320775),KG,,,,,,,N,0,,
'FD120219,GRATED COCONUT,มะพร้าวขูดขาว,KG,,,,,,,N,0,,
'FD120221,GUAVA FRUIT-แป้นทอง,ฝรั่งแป้นทอง,KG,,,,,,,N,0,,
'FD120222,GUAVA FRUIT-กิมจู,ฝรั่งกิมจู,KG,,,,,,,N,0,,
'FD120224,JACK FRUIT PEELED WITH SEED,ขนุนแกะ(มีเม็ด),KG,,,,,,,N,0,,
'FD120225,JINTARA WATERMELON,แตงโมจินตรา,KG,,,,,,,N,0,,
'FD120229,KIWI FRUIT (1x6)(192259),กีวี (1x6)(192259),PCS,,,,,,,N,0,,
'FD120232,LEMON FRUIT,มะนาวแป้น(ผิวสวยๆ),PCS,,,,,,,N,0,,
'FD120233,LEMON FRUIT BIG ( NO SEED ),มะนาวใหญ่ไร้เม็ด,KG,55,,,,,,N,0,,
'FD120241,MANGO,มะม่วงดิบ,KG,,,,,,,N,0,,
'FD120242,MANGO NAM DOK MAI YELLOE 1KG.(1x3)/(828271),มะม่วงน้ำดอกไม้สุกกล่อง 1 กก.(1x3)/(828271),KG,,,,,,,N,0,,
'FD120243,MANGO YELLOW (2-3 ลูก/กก.) (189501),มะม่วงน้ำดอกไม้สุก(2-3 ลูก/กก.)/(189501),KG,,,,,,,N,0,,
'FD120256,ORANGE SUNQUID KG,ส้มซันควิด,KG,,,,,,,N,0,,
'FD120258,PANDANUS LEAVES,เตยหอม,KG,,,,,,,N,0,,
'FD120259,PAPAYA HONLAND,มะละกอฮอลแลนด์,KG,,,,,,,N,0,,
'FD120260,PAPAYA RAW,มะละกอดิบ,KG,20,,,,,,N,0,,
'FD120261,PINEAPPLE LARGE,สับปะรดใหญ่,PCS,,,,,,,N,0,,
'FD120262,PINEAPPLE SRIRACHA (120101),สับปะรดศรีราชา/ปัตตาเวีย (120101),KG,,,,,,,N,0,,
'FD120272,ROSE APPLE RED (828275),ชมพู่แดง (828275),KG,,,,,,,N,0,,
'FD120289,YOUNG COCONUT(CUT) - GREEN,มะพร้าวอ่อนปอกเปลือกปาดเขียว(ปาดหัว/ท้าย),PCS,,,,,,,N,0,,
'FD120291,แตงโมกินรี,แตงโมกินรี,KG,,,,,,,N,0,,
'FD120296,องุ่นแดงไร้เมล็ด AUS 1 กก.,องุ่นแดงไร้เมล็ด AUS 1 กก.,KG,,,,,,,N,0,,
'FD120297,MANGO YELLOW,มะม่วงโชคอนันต์สุก,KG,,,,,,,N,0,,
'FD120298,SA LEE FRUIT,สาลี่ทอง,KG,,,,,,,N,0,,
'FD120300,YOUNG COCONUT(CUT) - WHITE,มะพร้าวอ่อนปาดขาว,PCS,,,,,,,N,0,,
'FD120303,CANTALOUP ORANGE,แคนตาลูปส้ม,KG,,,,,,,N,0,,
'FD120307,CHOKUN ORANGE,ส้มโชกุน(ใหญ่ 5 ลูก/เล็ก 9 ลูกสำหรับผลไม้ไหว้ศาล),KG,,,,,,,N,0,,
'FD120320,BANANA LARGE,กล้วยหอม,BUNCH,,,,,,,N,0,,
'FD120329,แห้วปอกเปลือก,แห้วปอกเปลือก,KG,,,,,,,N,0,,
'FD120330,LEMON YELLOW BIG,มะนาวเหลือง,KG,68,,,,,,N,0,,
'FD120333,AVOCADO(EACH),อโวคาโด(ลูก),PCS,65,,,,,,N,0,,
'FD120338,BANANA FINGER,กล้วยเล็บมือนาง,BUNCH,,,,,,,N,0,,
'FD120341,BLUEBERRIES JUMBO 125G. (861270),บลูเบอร์รี่จัมโบ้ 125ก.(861270),PACK,,,,,,,N,0,,
'FD120344,CANTALOUP MELON GREEN (160623),แคนตาลูปเมลอนเขียว(160623),KG,,,,,,,N,0,,
'FD120348,COCONUT CREAM FOR STICKY RICE,หัวกะทิ-สำหรับมูนข้าวเหนียว,KG,,,,,,,N,0,,
'FD120349,JUICE CONCENTRATE PINEAPPLE 2L.,น้ำผลไม้เข้มข้น-สับปะรด 2 ลิตร,BTL,,,,,,,N,0,,
'FD120351,DRAGON FRUIT 3 PCS,แก้วมังกรขาว(ขอ3ลูกผลไม้ไหว้ศาล),KG,,,,,,,N,0,,
'FD120356,GRAPES RED,องุ่นแดง,KG,,,,,,,N,0,,
'FD120359,JACK FRUIT PEELED WITH OUT SEED,ขนุนแกะ(เม็ด),KG,,,,,,,N,0,,
'FD120361,JUJUBE,พุทรา,KG,,,,,,,N,0,,
'FD120366,KEOW SAVOY MANGO 1KG. (790998),มะม่วงเขียวเสวย 1 กก.(790998),KG,,,,,,,N,0,,
'FD120367,LONG KONG,ลองกอง,KG,,,,,,,N,0,,
'FD120368,LONGAN,ลำไย,KG,,,,,,,N,0,,
'FD120369,MANDARIN ORANGE,ส้มแมนดาริน,KG,,,,,,,N,0,,
'FD120375,OLD COCONUT,มะพร้าวแก่(ปลอกเปลือก),PCS,,,,,,,N,0,,
'FD120377,ORANGE LOCAL,ส้มสายน้ำผึ้ง,KG,,,,,,,N,0,,
'FD120378,ORANGE LOCAL NO.1,ส้มเขียวหวาน เบอร์ 1,KG,,,,,,,N,0,,
'FD120379,ORANGE LOCAL NO.O,ส้มเขียวหวาน เบอร์ 0,KG,,,,,,,N,0,,
'FD120381,PAPAYA RIPE,มะละกอแขกดำ(สุก),KG,,,,,,,N,0,,
'FD120384,PINEAPPLE PU-LE (816843),สัปปะรดภูแล (816843),KG,,,,,,,N,0,,
'FD120386,RAMBUTAN,เงาะ,KG,,,,,,,N,0,,
'FD120387,RASPBERRY FG 120G.,RASPBERRY FG 120G.,PACK,,,,,,,N,0,,
'FD120390,SA LEE FRUIT B 5 / S 5 PCS,สาลี่น้ำผึ้งถ้าใหญ่ 3 / เล็ก 5 ลูก(ผลไม้ไหว้ศาล),KG,,,,,,,N,0,,
'FD120392,STRABERRY FRESH 250G.(169955),สตรอเบอร์รีสดนำเข้า 250ก.(169955),PACK,,,,,,,N,0,,
'FD120393,STRAWBERRY IMPORT KR 250G.(24765),สตรอเบอร์รี่นำเข้าเกาหลี 250ก.(24765),PACK,,,,,,,N,0,,
'FD120394,STRAWBERRY IMPORT KR 330G.(24765),สตรอเบอร์รี่นำเข้าเกาหลี 330ก.(24765),PACK,,,,,,,N,0,,
'FD120398,TONGDEE POMELO 1 PCS. 120244,ส้มโอทองดี 1 ลูก.(120244),PCS,,,,,,,N,0,,
'FD120403,แก้วมังกรแดง,แก้วมังกรแดง,KG,,,,,,,N,0,,
'FD120404,แตงโม ตอปิโด,แตงโม-ตอปิโด,KG,,,,,,,N,0,,
'FD120405,แห้วสดปอกเปลือก 1 กก. (265577),แห้วสดปอกเปลือก 1 กก.(265577),KG,,,,,,,N,0,,
'FD120406,แห้วสดหั่นเต๋า 1 กก.(138297),แห้วสดหั่นเต๋า 1 กก.(138297),KG,,,,,,,N,0,,
'FD120409,กล้วยหอม เกรด A (120171),กล้วยหอมเกรด A (120171),BUNCH,,,,,,,N,0,,
'FD120413,มะพร้าวทึนทึก,มะพร้าวทึนทึก,PCS,,,,,,,N,0,,
'FD120414,มะม่วงแก้วขมิ้น (ดิบ),มะม่วงแก้วขมิ้น(ดิบ),KG,,,,,,,N,0,,
'FD120416,ส้มโชกุนลูกใหญ่,ส้มโชกุนลูกใหญ่,KG,,,,,,,N,0,,
'FD120419,องุ่นเขียวไร้เมล็ดอินเดีย 1 กก.(158378),องุ่นเขียวไร้เมล็ดอินเดีย 1 กก. (158378),KG,,,,,,,N,0,,
'FD120420,องุ่นแดงไร้เมล็ดอินเดีย 1 กก.(39663),องุ่นแดงไร้เมล็ดอินเดีย 1 กก.(39663),KG,,,,,,,N,0,,
'FD120421,องุ่นดำไร้เมล็ดอินเดีย 1 กก. (184015),องุ่นดำไร้เมล็ดอินเดีย 1 กก.(184015),KG,,,,,,,N,0,,
'FD171271,COCONU CHUNKED NAM HOM ALL COCO 1KG.(813532),เนื้อมะพร้าวน้ำหอมแบบแผ่นแช่แข็ง 1 กก. (813532),KG,,,,,,,N,0,,
'FD171272,FROZE MIX BERRY ARO 1KG.(826024),ผลไม้รวมเบอร์รี่แช่แข็ง เอโร่ 1 กก.(826024),KG,,,,,,,N,0,,
'FD171273,FROZEN PASSION FRUIT WITH SEED ARO 1KG.(229338),น้ำเสาวรสมีเมล็ดแช่แข็ง เอโร่ 1กก.(229338),KG,,,,,,,N,0,,
'FD171274,FROZEN SWEET CORN KERNEL ARO 1KG.(851335),ข้าวโพดแช่แข็ง เอโร่ 1 กก.(851335),KG,,,,,,,N,0,,
'FD171275,FROZEN WILD STRAWBERRY ARO 1KG.(125456),สตรอเบอรี่แช่แข็ง เอโร่ 1 กก.(125456),KG,,,,,,,N,0,,
'FD171276,MANDARIN ORANGE FROZEN SEGMENT ARO 1KG.(160355),เนื้อส้มแมนดารินแช่แข็ง เอโร่ 1 กก.(160355),KG,,,,,,,N,0,,
'FD171277,RASPBERRY FROZEN  ARO 1KG.(127970),ราสเบอร์รี่แช่แข็ง เอโร่ 1 กก.(127970),KG,,,,,,,N,0,,
'FD171285,มะม่วงน้ำดอกไม้หั่นเต๋าแช่แข็ง เอโร่1 กก.(821069),มะม่วงน้ำดอกไม้หั่นเต๋าแช่แข็ง เอโร่ 1กก.(821069),BAG,,,,,,,N,0,,
'FD171304,BLACKBERRIES TH FG 160G.,BLACKBERRIES TH FG 160G.,PACK,,,,,,,N,0,,
'FD171305,COCONUT FLESH NAM HOM 1KG.(829152),เนื้อมะพร้าวน้ำหอมแช่เยือกแข็งแบบเส้น1 กก.(829152),KG,,,,,,,N,0,,
'FD171310,FROZEN STRAWBERRY ARO 1KG.(1x10)/(137377),สตรอว์เบอร์รีแช่แข็ง เอโร่ 1 กก.(1x10)/(137377),CASE,,,,,,,N,0,,
'FD171312,PASSION FRUIT JUICE WITH SEEDS NCW 1KG.(863489),น้ำเสาวรสมีเมล็ดแช่แข็ง NCW 1 กก.(863489),BAG,,,,,,,N,0,,
'FD120179,BABY CORN,ข้าวโพดอ่อน,KG,38,,,,,,N,0,,
'FD120181,BANANA FLOWER,หัวปลี,EA,15,,,,,,N,0,,
'FD120182,BANANA LEAVE,ใบตอง,KG,25,,,,,,N,0,,
'FD120184,BEANS WING,ถั่วพลู,KG,85,,,,,,N,0,,
'FD120185,BEANSPROUTS CLEANED,ถั่วงอก,KG,15,,,,,,N,0,,
'FD120186,BELL PEPPER GREEN,พริกยักษ์เขียว,KG,80,,,,,,N,0,,
'FD120187,BELL PEPPER RED,พริกยักษ์แดง,KG,90,,,,,,N,0,,
'FD120188,BELL PEPPER YELLOW,พริกยักษ์เหลือง,KG,100,,,,,,N,0,,
'FD120189,BIRD CHILI (233298),พริกขี้หนูสวนไม่เด็ด(233298),KG,220,,,,,,N,0,,
'FD120191,CARROT,แครอท,KG,20,,,,,,N,0,,
'FD120192,CELERY IMPORT,คื่นช่ายฝรั่ง,SET,58,,,,,,N,0,,
'FD120193,CHAPOO LEAVES,ใบชะพลู,KG,60,,,,,,N,0,,
'FD120194,CHILI BRID RED,พริกขี้หนูแดง,KG,45,,,,,,N,0,,
'FD120195,CHILI BRID RED (CUT),พริกขี้หนูแดงเด็ด,KG,70,,,,,,N,0,,
'FD120196,CHILI DRY LARGE,พริกแห้งใหญ่,KG,150,,,,,,N,0,,
'FD120197,CHILI DRY SMALL,พริกแห้งเล็ก,KG,200,,,,,,N,0,,
'FD120198,CHILLI FINGER ( GREEN ),พริกชี้ฟ้าเขียว,KG,60,,,,,,N,0,,
'FD120199,CHILLI FINGER ( RED ),พริกชี้ฟ้าแดง,KG,60,,,,,,N,0,,
'FD120200,CHINESE MORNING GLORY,ผักบุ้งจีน,KG,,,,,,,N,0,,
'FD120202,CHINESES CHIVES,กุ้ยฉ่ายเขียว(ต้น),KG,60,,,,,,N,0,,
'FD120203,CHOA PRAYA EGGPLANT,มะเขือเปราะ,KG,25,,,,,,N,0,,
'FD120205,CORN ON THE COB,ข้าวโพดฝัก(ปอกเปลือก),KG,28,,,,,,N,0,,
'FD120206,CUCUMBER LARGE,แตงกวาใหญ่,KG,20,,,,,,N,0,,
'FD120207,CUCUMBER SMALL,แตงกวาเล็ก,KG,30,,,,,,N,0,,
'FD120208,DILL LEAVES,ผักชีลาว,KG,55,,,,,,N,0,,
'FD120210,EGG PLANT GREEN LONG,มะเขือยาวเขียว,KG,35,,,,,,N,0,,
'FD120211,FRENCH BEAN,ถั่วแขก,KG,38,,,,,,N,0,,
'FD120212,PEPPER CORN,พริกไทยอ่อน,KG,130,,,,,,N,0,,
'FD120213,ROSEMARY LEAF (31538),ใบโรสแมรี่สด(31538),KG,,,,,,,N,0,,
'FD120214,GALANGA WHOLE YOUNG(323648),ข่าอ่อน(323648),KG,40,,,,,,N,0,,
'FD120215,GINGER OLD,ขิงแก่,KG,60,,,,,,N,0,,
'FD120216,GINGER SLICED,ขิงฝอย,KG,65,,,,,,N,0,,
'FD120220,GREEN OAK 0.5 KG.,กรีนโอ๊ด 0.5 กก.,KG,,,,,,,N,0,,
'FD120223,HOT BASIL,กระเพรา,KG,40,,,,,,N,0,,
'FD120226,KAFFIR LIME LEAVE,ใบมะกรูด,KG,50,,,,,,N,0,,
'FD120227,KALE,คะน้า,KG,33,,,,,,N,0,,
'FD120228,KAMIN FRESH,ขมิ้นสด,KG,50,,,,,,N,0,,
'FD120230,KWANG TUNG,กวางตุ้ง,KG,30,,,,,,N,0,,
'FD120231,LEEK ( TON KRA THIAM ),ต้นกระเทียม,KG,85,,,,,,N,0,,
'FD120234,LEMONGRASS,ตะไคร้,PCS,1,,,,,,N,0,,
'FD120235,LETTUCE GREEN,กาดหอมสีเขียว,KG,,,,,,,N,0,,
'FD120236,LETTUCE ICEBERG,กาดแก้ว,KG,58,,,,,,N,0,,
'FD120237,LOCAL PEPPER GREEN,พริกหยวก,KG,70,,,,,,N,0,,
'FD120238,LONG PARSLES,ชีใบเลื่อย,KG,60,,,,,,N,0,,
'FD120239,LUFFA,บวบเหลี่ยม,KG,28,,,,,,N,0,,
'FD120240,MANGLUK LEAVE,ใบแมงลัก,KG,60,,,,,,N,0,,
'FD120244,MARROW VAGETABLE,ฟักเขียว,KG,15,,,,,,N,0,,
'FD120245,MINT LEAF,สาระแหน่,KG,105,,,,,,N,0,,
'FD120246,MORNING GLORY,ผักบุ้งไทย,KG,25,,,,,,N,0,,
'FD120247,MUSHROOM ERYNJI 1KG.,เห็ดเออรินจิ 1 กก.,KG,,,,,,,N,0,,
'FD120248,MUSHROOM JELLY,เห็ดหูหนูสด,KG,55,,,,,,N,0,,
'FD120249,MUSHROOM OYSTER,เห็ดนางฟ้า,KG,80,,,,,,N,0,,
'FD120250,MUSHROOM SHIMEJI BLACK,เห็ดชิเมจิดำ,PACK,,,,,,,N,0,,
'FD120251,MUSHROOM SHIMEJI WHITE,เห็ดชิเมจิขาว,PACK,15,,,,,,N,0,,
'FD120252,MUSHROOM STRAW (324038),เห็ดฟาง(324038),KG,,,,,,,N,0,,
'FD120253,MUSHROOM WHITE,เห็ดหูหนูขาว,KG,350,,,,,,N,0,,
'FD120254,ONION LARGE,หอมใหญ่,KG,,,,,,,N,0,,
'FD120255,ONION SPRING,ต้นหอม,KG,60,,,,,,N,0,,
'FD120257,PAK MEANG,ผักเหมียง,KG,110,,,,,,N,0,,
'FD120263,POTATO LARGE,มันฝรั่งใหญ่,KG,33,,,,,,N,0,,
'FD120264,POTATO SWEET,มันเทศ,KG,30,,,,,,N,0,,
'FD120265,PUMPKIN LARGE,ฟักทองใหญ่,KG,22,,,,,,N,0,,
'FD120266,RA LEAF,ใบรา,KG,65,,,,,,N,0,,
'FD120267,RADICHIO,เรดิชิโอ้,KG,145,,,,,,N,0,,
'FD120268,RED CORAL,เรดโครอล,KG,130,,,,,,N,0,,
'FD120269,RED OAK 0.5 KG.,เรดโอ๊ด 0.5 กก.,KG,110,,,,,,N,0,,
'FD120270,RHY ZOME,กระชาย,KG,60,,,,,,N,0,,
'FD120271,ROMAIN COS CHINESE,โรแมนคอส,KG,65,,,,,,N,0,,
'FD120273,SMALL LOTUS LEAF,ใบบัวบก,KG,60,,,,,,N,0,,
'FD120274,STRING BEANS,ถั่วฝักยาว,KG,45,,,,,,N,0,,
'FD120275,SWEET BASIL,โหระพา,KG,40,,,,,,N,0,,
'FD120276,SWEET PEA /KG,ถั่วลันเตาหวาน/กก.,KG,,,,,,,N,0,,
'FD120277,SWEET VEGELTABLE,ผักหวาน,BUNDLE,,,,,,,N,0,,
'FD120278,TARO ROOT,เผือก,KG,,,,,,,N,0,,
'FD120279,THAI PARSLEY,ผักชีไทย,KG,130,,,,,,N,0,,
'FD120280,TOMATO QUEEN,มะเขือเทศราชินี,KG,70,,,,,,N,0,,
'FD120281,TOMATO RED,มะเขือเทศท้อ,KG,,,,,,,N,0,,
'FD120282,TOMATO SEDA,มะเขือเทศสีดา,KG,50,,,,,,N,0,,
'FD120283,TURNIP DRIED FLAKE,ไชโป๊วสับ,KG,55,,,,,,N,0,,
'FD120284,TURNIP FLAKE,ไชโป๊วหวานฝอย,KG,55,,,,,,N,0,,
'FD120285,TURNIP WHITE,หัวไชเท้า,KG,25,,,,,,N,0,,
'FD120286,WHITE LETTUCE,กาดขาว,KG,27,,,,,,N,0,,
'FD120287,YOD MUI,ยอดหมุย,KG,12,,,,,,N,0,,
'FD120288,YOD MUN POO,ยอดมันปู,BUNDLE,12,,,,,,N,0,,
'FD120290,ZUCHINI,ซูกินีเขียว,KG,65,,,,,,N,0,,
'FD120292,กระเทียมไทยกลีบ,กระเทียมไทยกลีบ,KG,85,,,,,,N,0,,
'FD120293,กระเทียมจีนหัว(829336),กระเทียมจีนหัว(829336),KG,,,,,,,N,0,,
'FD120294,คะน้าฮ่องกง,คะน้าฮ่องกง,KG,100,,,,,,N,0,,
'FD120295,มันม่วง,มันม่วง,KG,,,,,,,N,0,,
'FD120299,SHALLOT,หอมแดงไทย,KG,120,,,,,,N,0,,
'FD120301,ASPARAGUS GREEN 1KG.,หน่อไม้ฝรั่งสด 1 กก.,KG,170,,,,,,N,0,,
'FD120302,BROCCOLI,บล็อคโคลี่,KG,50,,,,,,N,0,,
'FD120304,CAULIFIOWER EXPORT,ดอกกะหล่ำนอก,KG,60,,,,,,N,0,,
'FD120305,CAULIFLOWER,ดอกกะหล่ำใน,KG,,,,,,,N,0,,
'FD120306,CHILI BRID GREEN (CUT),พริกขี้หนูเขียว(เด็ด),KG,,,,,,,N,0,,
'FD120308,EGGPLANT PURPLE,มะเขือม่วงกลม,KG,,,,,,,N,0,,
'FD120309,FRILLICE ICEBERG,ฟิลเลย์ไอซ์เบิร์ก,KG,115,,,,,,N,0,,
'FD120310,GARLIC LARGE & TO LEVER OUT,กระเทียมใหญ่(แกะ),KG,70,,,,,,N,0,,
'FD120311,ITALIAN BASIL,โหระพาอิตาเลียน,KG,,,,,,,N,0,,
'FD120312,KAFFIRLIME,ลูกมะกรูด,PCS,,,,,,,N,0,,
'FD120313,PALM HEAD,ยอดมะพร้าว(หัว),KG,60,,,,,,N,0,,
'FD120314,PARSLEY FRENCH,ผักชีฝรั่ง/พาสเลย์,KG,100,,,,,,N,0,,
'FD120315,RED CABBAGE,กะหล่ำม่วง,KG,,,,,,,N,0,,
'FD120316,ROSE RED,ดอกกุหลาบแดง,PCS,,,,,,,N,0,,
'FD120317,SHALLOT (CUT),หอมแดงพม่า(แกะ),KG,,,,,,,N,0,,
'FD120318,SNOW PEA,ถั่วลันเตา,KG,125,,,,,,N,0,,
'FD120319,TAM LUNG,ตำลึง(เด็ด),KG,70,,,,,,N,0,,
'FD120321,CELERY THAI,คื่นช่ายไทย,KG,,,,,,,N,0,,
'FD120322,TOMATO BIG BEEF,มะเขือเทศเนื้อ,KG,48,,,,,,N,0,,
'FD120323,EGG PLANT SMALL ( SPLIT ),มะเขือพวง(เด็ด),KG,98,,,,,,N,0,,
'FD120324,TURMERIC WHITE,ขมิ้นขาว,KG,,,,,,,N,0,,
'FD120325,BAMBOO PICKLED YELLOW,หน่อไม้เหลืองยาว(ต้ม),KG,,,,,,,N,0,,
'FD120326,BAMBOO YELLOW FLAK,หน่อไม้เหลืองฝอย,KG,50,,,,,,N,0,,
'FD120327,CABBAGE  WHITE,กะหล่ำปลีขาว,KG,25,,,,,,N,0,,
'FD120328,CUCUMBER JAPANESE,แตงกวาญี่ปุ่น,KG,65,,,,,,N,0,,
'FD120331,ACAEIAL INSUAVIS,ชะอม,BUNDLE,30,,,,,,N,0,,
'FD120332,ALFALFA SPROUTS 50G.,ต้นอ่อนอัลฟาฟ่า 50ก.,PACK,,,,,,,N,0,,
'FD120334,BABY CARROT,เบบี้เเครอท,KG,95,,,,,,N,0,,
'FD120335,BABY COS,เบบี้คอส,KG,,,,,,,N,0,,
'FD120336,BABY POTATO,เบบี้โปเต้โต้,KG,,,,,,,N,0,,
'FD120337,BAMBOO SHOOTS PICKLED KG.,หน่อไม้ดอง,KG,38,,,,,,N,0,,
'FD120339,BEETROOT,บีทรูท,KG,45,,,,,,N,0,,
'FD120340,BITTER CUCUMBER,มะระ,KG,35,,,,,,N,0,,
'FD120342,BUTTER HEAD,บัตเตอร์เฮด,KG,90,,,,,,N,0,,
'FD120343,CALAHASH,ลูกน้ำเต้า,KG,,,,,,,N,0,,
'FD120345,CHILI BRID GREEN,พริกขี้หนูเขียว(ไม่เด็ด),KG,,,,,,,N,0,,
'FD120346,CHILI DRY SMALL (CUT) 0.5KG.,พริกแห้งเล็ก(เด็ด) 0.5 กก.,KG,,,,,,,N,0,,
'FD120347,CHINESE SALTED RADISH,หัวไชโป๊วเค็ม,KG,,,,,,,N,0,,
'FD120350,CORN ON THE NO COB,ข้าวโพดฝัก(ไม่ปอกเปลือก),KG,,,,,,,N,0,,
'FD120352,FRESH THYME LEAF (26260),ใบไทม์สด(26260),KG,,,,,,,N,0,,
'FD120353,GALANGA WHOLE STRONG,ข่าแก่,KG,,,,,,,N,0,,
'FD120354,GARLIC LARGE,กระเทียมใหญ่,KG,,,,,,,N,0,,
'FD120355,GINGER BABY (323661),ขิงอ่อน(323661),KG,60,,,,,,N,0,,
'FD120357,GREEN COS LETTUCE HYDROPONIC 500G.(193982),สลัดกรีนคอส(ไฮโดรโปนิค)500ก.(193982),PACK,,,,,,,N,0,,
'FD120358,INDIAN ONION 10 KG.,หอมแดงอินเดีย 10 กก./กส.,SACK,,,,,,,N,0,,
'FD120360,JAPANESE PUMPKIN,ฟักทองญี่ปุ่น,KG,80,,,,,,N,0,,
'FD120362,KAI LAN (151020),ยอดคะน้าฮ่องกง (151020),KG, ,,,,,,N,0,,
'FD120363,KANANG,แขนง,KG,38,,,,,,N,0,,
'FD120364,KEELEK FLOWER,ดอกขี้เหล็กต้ม,KG,,,,,,,N,0,,
'FD120365,KEELEK LEAVES,ใบขี้เหล็กต้ม,KG,,,,,,,N,0,,
'FD120370,MANGO CREST,ยอดมะม่วงหิมพานต์,BUNDLE,10,,,,,,N,0,,
'FD120371,MORINGA,ผักมะรูม,BUNDLE,,,,,,,N,0,,
'FD120372,MUSHROOM ENOKI(KHEM THONG)(200G./PACK ),เห็ดเข็มทอง(200G./PACK ),PACK,,,,,,,N,0,,
'FD120373,MUSHROOM FRESH SHITAKE 1KG.,เห็ดหอมสด 1 กก.,KG,140,,,,,,N,0,,
'FD120374,OKRA,กระเจี๊ยบเขียว,KG,38,,,,,,N,0,,
'FD120376,ONION SPRING FLOWER,ดอกหอม,KG,,,,,,,N,0,,
'FD120380,PAK GROOD ( EDIBIE FERN ),ผักกูด,BUNDLE,,,,,,,N,0,,
'FD120382,PICKLE NUT BIG HEADS,ถั่วดองหัวโต,KG,150,,,,,,N,0,,
'FD120383,PICKLED GINGE,ขิงดอง,BTL,160,,,,,,N,0,,
'FD120385,PUMPKIN SMALL,ฟักทองเล็ก,KG,,,,,,,N,0,,
'FD120388,RED RADISH,เรดิช,KG,75,,,,,,N,0,,
'FD120389,ROCKET,ร็อกเก็ต,KG,300,,,,,,N,0,,
'FD120391,SHOWN LEAVES CUT,โชนหั่น,KG,60,,,,,,N,0,,
'FD120395,SUNFLOWER SPROUTS 500 G. (208299),ต้นอ่อนทานตะวัน 500ก.(208299),KG,150,,,,,,N,0,,
'FD120396,TAM LUAN,ตำลึง,KG,,,,,,,N,0,,
'FD120397,TOMATO RED CHERRY,มะเขือเทศเชอรี่สีแดง,KG,75,,,,,,N,0,,
'FD120399,TOU MEAU 200 G.,ต้นอ่อนโต้วเหมี่ยว 200ก.,PACK,,,,,,,N,0,,
'FD120400,WHOLE THAI GARLIC,กระเทียมไทย,KG,,,,,,,N,0,,
'FD120401,YAM BEAN WHOLE,มันแกวหัว,KG,30,,,,,,N,0,,
'FD120402,YOUNG KALE(80561),ยอดคะน้า (80561),KG,,,,,,,N,0,,
'FD120407,โรเมนคอสไทย(193982)500g,โรเมนคอสไทย(193982) 500ก.,PACK,,,,,,,N,0,,
'FD120408,ใบชะมวง,ใบชะมวง,KG,,,,,,,N,0,,
'FD120410,ตะไคร้ 1*100/มัด,ตะไคร้ 1*100/มัด,BUNDLE, ,,,,,,N,0,,
'FD120411,ผักบุ้งก้านแดง,ผักบุ้งก้านแดง,KG,,,,,,,N,0,,
'FD120412,มะพร้าวคั่ว,มะพร้าวคั่ว,KG,,,,,,,N,0,,
'FD120415,ยอดกระถิน,ยอดกระถิน,BUNDLE,12,,,,,,N,0,,
'FD120417,สะตอ,สะตอ,KG,,,,,,,N,0,,
'FD120418,หอมแดงไทย แบบมัดจุก,หอมแดงไทยแบบมัดจุก,KG,,,,,,,N,0,,
'FD140462,EGG NO.2 (1x30),ไข่ไก่ เบอร์.2 (1x30),PCS,,,,,,,N,0,,
'FD140463,EGG NO.3 (1x30),ไข่ไก่ เบอร์.3 (1x30),PCS,,,,,,,N,0,,
'FD140511,BOILED EGG SALTED,ไข่เค็มสุก,PCS,,,,,,,N,0,,
'FD140515,CENTURY EGG,ไข่เยี่ยวม้า,PCS,,,,,,,N,0,,
'FD140525,DUCK EGG,ไข่เป็ด,PCS,,,,,,,N,0,,
'FD140529,EGG SALTED,ไข่เค็มดิบ,PCS,,,,,,,N,0,,
'FD140565,QUAIL EGG 50 PCS(132312),ไข่นกกระทาดิบ 50 ฟอง(132312),PCS,,,,,,,N,0,,
'FD140566,QUAIL EGG PEEL(1x50),ไข่นกกระทาปอกเปลือก(1x50),PACK,,,,,,,N,0,,
'FD140582,ไข่แดงเค็ม(1x10ฟอง),ไข่แดงเค็ม(1x10 ฟอง),PACK,,,,,,,N,0,,
'FD161258,น้ำแกงแพะ,น้ำแกงแพะ,BAG,,,,,,,N,0,,
'FD161220,รวมมิตรดิบ,รวมมิตรดิบ,KG,,,,,,,N,0,,
'FD161224,KANOM LOD CHONG PANDANUS,ขนมลอดช่องใบเตย,KG,,,,,,,N,0,,
'FD161225,KANOM KLONG KLEAK,ขนมคลองแคลงดิบ,KG,,,,,,,N,0,,
'FD161229,COCONUT JELATINE (PACK),วุ้นมะพร้าว(ใส่ในของหวาน),PACK,,,,,,,N,0,,
'FD161238,JELATINE  BLACK,เฉาก๊วย(วุ้นดำ),KG,,,,,,,N,0,,
'FD161239,KANOM  POOYFAI,ขนมปุยฝ้าย,PCS,,,,,,,N,0,,
'FD161240,KANOM BAULOY PHUKET,ขนมบัวลอยดิบ-ภูเก็ต,KG,,,,,,,N,0,,
'FD161241,KANOM FOUY THONG,ขนมฝอยทอง,PCS,,,,,,,N,0,,
'FD161242,KANOM THONG YIB,ขนมทองหยิบ,PCS,,,,,,,N,0,,
'FD161243,KANOM THONG YOD,ขนมทองหยอด,PCS,,,,,,,N,0,,
'FD161245,LOD CHONG SINGAPORE,ลอดช่องสิงค์โปร์,KG,80,,,,,,N,0,,
'FD161246,LOOK CHID,ลูกชิด,KG,80,,,,,,N,0,,
'FD161247,MED KANUN,ขนมเม็ดขนุน,PCS,,,,,,,N,0,,
'FD161253,STICKY RICE MOON,ข้าวเหนียวมูนขาว,KG,,,,,,,N,0,,
'FD161254,THAI DESSERT,ขนมไทย,SET,,,,,,,N,0,,
'FD161255,TUB TIM GOB,ทับทิมกรอบ,KG,220,,,,,,N,0,,
'FD161257,ขนมสอดไส้,ขนมสอดไส้,PCS,,,,,,,N,0,,
