SKU#,Description,Local Description,Unit,Qty From,QtyTo,Quote Price,Foc,Discount Percent,Discount Amount,TaxType,TaxRate,Vendor SKU#,Comment
'31000017,ดอกไม้กำห่อใบเตย (ไม่เอาดาวเรือง) (DPP),ดอกไม้กำห่อใบเตย(ไม่เอาดาวเรือง)(DPP),BUNDLE,,,20,,,,N,0,,
'31000086,MARIGOLD GARLAND (RPD),มาลัยฮาวายดาวเรือง (RPD),SET,,,10,,,,N,0,,
'31000087,MARIGOLD GARLAND BUNCH (DPP),พวงมาลัยดาวเรืองกลม (DPP),SET,,,100,,,,N,0,,
'31000104,SEVEN COLOR FLOWER,ดอกไม้ 7 สี,SET,,,150,,,,N,0,,
'31000190,ดอกกุหลาบสีแดง,ดอกกุหลาบสีแดง,Pcs,,,20,,,,N,0,,
'34040054,ชุดหมากพลู,ชุดหมากพลู,SET,,,15,,,,N,0,,
